country,name,descriptionthailand,Theradex,"Theradex was founded in 1982 with the award of the Clinical Trials Monitoring Service contract for the National Cancer Institute (NCI) in the United States. The Clinical Trial Monitoring Service provides central data management and monitoring services for early phase cancer trials sponsored by the NCI. In 2014, the services expanded to support trials conducted under the NCI Experimental Therapeutics Clinical Trials Network (ETCTN). Theradex’s support of NCI programs also includes audits of NCI-supported cancer center programs participating in NCI sponsored clinical trials.Theradex’s early collaboration with NCI led to an expansion of services to pharmaceutical industry sponsored oncology clinical trials. Theradex has always recognized that each sponsor requires a personalized approach to meet their drug development and business needs. This commitment to service has supported Theradex’s growth which has been primarily driven by referrals. The continued focus on personalized service has been Theradex’s approach to business development.With the expansion of services to support our varied client base, the Theradex (Europe) Ltd office opened in 1992 enabling the company to expand services to Europe. Since 1992 Theradex has provided global services through partner relationships in other geographic regions including Asia.Theradex has continued to expand our capabilities by introducing efficiencies to the clinical trial process through integrated systems and expanding our expertise as personalized medicine becomes a reality.Theradex history has spanned over three decades from the early days of clinical trials with limited advances in oncology to the more rapid advances of today where pathways and patient genetic profiles are driving a targeted approach to treatment and research efforts.Our strong interest in the science of new therapeutic approaches has led Theradex to evolve with the advancements in cancer treatment. Theradex remains committed to the science of cancer research and our clients who continue to drive the advances in treatment options for cancer patients. "
turkey,Covance,"Covance Inc., a global contract research organization (CRO), is the world’s most comprehensive drug development company.Covance Inc., the drug development business of LabCorp®, is the world’s most comprehensive drug development company, dedicated to advancing healthcare and delivering Solutions Made Real®. Our unique perspectives, built from decades of scientific expertise and precision delivery of the largest volume of drug development data in the world, along with our innovative technology solutions, help our clients identify new approaches and anticipate tomorrow’s challenges as they evolve. Together with our clients, Covance transforms today’s healthcare challenges into tomorrow’s solutions. We also offer laboratory testing services to the chemical/agrochemical industries and are a market leader in toxicology services, central laboratory services, discovery services and a top global provider of Phase III clinical trial management services. "
turkey,"KRI, Inc. (Kansai Research Institute)","In contract research area, KRI provides solutions to technology problems in a wide range of areas including electric materials, nanomaterials, energy conversion technology and environmental conservation technology. KRI is putting forward a variety of combinations involving material technology which includes inorganic materials, polymer materials besides hybrid materials, device technology, in addition to biotechnology which processes microorganisms, property evaluation, and detection technology. KRI is also aggressively promoting novel R&D technology plans building on the KRI's own original technologies. "
turkey,MicroConstants,"MicroConstants Overview: We are a GLP-compliant Contract Research Organization focused on performing bioanalysis, drug metabolism, and pharmacokinetic analysis in support of new therapeutic development programs. We specialize in method development, validation, and sample analysis for small molecules and macromolecules using LC/MS/MS, HPLC/UV, and immunoassay techniques. "
turkey,MTZ Clinical Research,"MTZ Clinical Research Unit focuses on phase I, early clinical  development, bioequivalence and phase III studies. "
ukraine,Biometrix,"Thank you for visiting our website, and for your interest in learning more about our company.Biometrix was founded in 1994, with the goal of providing high quality instrumentation services at a reasonable price to the biotechnology, pharmaceutical and medical devices industries of New England.Over the years we have expanded the depth and range of our expertise so that we can provide our customers with a more comprehensive service offering. Our capabilities include:On-site calibrationCalibration master plan consultingCalibration turnkey program creation and implementationCalibration staffingCommissioningValidationAutoclave cycle development consultingUser requirements specifications consultingValidation staffingWe've also expanded our geographic reach, as we now service small and large calibration and validation projects throughout North America. And for the launching of major biopharmaceutical manufacturing facilities, our commissioning team is able to travel throughout the United States and internationally. We take great pride in providing high quality equipment and systems services for the FDA-regulated environment. We understand how to provide calibration, validation and commissioning in a manner compliant with GMP and your internal quality guidelines "
ukraine,Covance,"Covance Inc., a global contract research organization (CRO), is the world’s most comprehensive drug development company.Covance Inc., the drug development business of LabCorp®, is the world’s most comprehensive drug development company, dedicated to advancing healthcare and delivering Solutions Made Real®. Our unique perspectives, built from decades of scientific expertise and precision delivery of the largest volume of drug development data in the world, along with our innovative technology solutions, help our clients identify new approaches and anticipate tomorrow’s challenges as they evolve. Together with our clients, Covance transforms today’s healthcare challenges into tomorrow’s solutions. We also offer laboratory testing services to the chemical/agrochemical industries and are a market leader in toxicology services, central laboratory services, discovery services and a top global provider of Phase III clinical trial management services. "
ukraine,Cropha CRO,"CROPHA is an innovative and unique Contract Research Organization (CRO) geared to raising the quality and investment value of Clinical Research Associates (CRAs) for the benefit of pharmaceutical and biotechnology companies and other CROs. Crown CRO provides services in the pharmaceutical, biotechnology, functional food and medical device sectors, as well as to other contract research organizations. Our services also cover quality assurance, pharmacovigilance, regulatory, and translation services. "
ukraine,Helix3 Inc,"The Helix3 team has been consistently working together since 1994 developing new methods and conducting GLP studies for regulatory submissions.  We are committed to providing innovative solutions with an unmatched focus on quality, flexibility and attention to detail. "
ukraine,MakroCare,"MakroCare is expert strategic development and commercialization global partner for pharmaceutical, biotechnology and medical device industries. Our experience, programs and processes bring a new dimension to development strategy, regulatory/risk planning & management, clinical research, medical/scientific support and emerging region expansion. "
ukraine,Medelis,Medelis is a full service oncology clinical research company. We provide sponsors with a highly-skilled and proactive oncology clinical trial management team to design and manage phase I through phase III oncology trials in North America and Europe. 
united_arab_emirates,AXON Medica,"axon MEDICA – The Healers; connecting needy patients to the compassionate professionals.Every visitor, guest and patient to axon MEDICA is an opportunity to the team to exhibit it’s core strength; the genuine patient-centric service. We are committed in delivering the best-in-class of healthcare services.axon MEDICA is the healthcare vertical of Health World Investments LLC. Health World is a new and growing organization that sets to make a mark in the field of healthcare. Health World has signed an MOU with a leading healthcare provider to start medical centres, clinics, pharmacies, diagnostic centres and labs in Dubai. Based in Dubai, United Arab Emirates, Health World is a part of Study World Group. "
united_arab_emirates,Promedica International,"With a track record of more than three decades working with industry leaders, mid-size and start–up companies, Promedica International (PMI) can support your clinical research projects with a wide range of specialized clinical study services, including:Clinical study design, management and monitoring for pre- and post-market studiesClinical data management and analysis services for pre- and post-market studiesMedical writingAuditing and training for GCPProduct development and Product commercializationWhether you contract Promedica for all or part of your project, you will work with a senior level team of research specialists who are experienced in project management, data management, and clinical services. Our project teams are carefully assembled to match your project requirements and organizational structure, and we form a partnership with you to conduct research that meets your specific goals and objectives.Our focus is to deliver professional quality work in an efficient manner so you can achieve your goals faster. From strategic planning through the market introduction process, Promedica International provides the people, processes and performance to facilitate the successful completion of your research project. "
uruguay,Activa Cro,"Activa Cro is a Regional Contract Research Organization operating in Latin America (South American Cro), that provides clinical research services to the pharmaceutical , biotechnology and medical device/diagnostic industry in Argentina, Brazil, Chile, Colombia, México, Panama, Perú, Ecuador and Uruguay. "
uruguay,Ethica Clinical,"Ethica CRO Inc. is a full-service Contract Research Organization (CRO) that conducts and manages ethical clinical research on drugs, biologics, medical devices and natural health products. "
uruguay,Venn Life Sciences,"Venn Life Sciences is an Integrated Drug Development Partner offering a unique combination of drug development expertise, clinical trial design and execution services. This enables us to create, plan and execute drug and medical device development programs effectively and seamlessly for our clients. We have dedicated operations in Ireland, France, Germany, the Netherlands, the UK, the US, and Europe-wide representation.We have teams across both early and late phase research. Our late phase teams specialise in multi-site cross cultural clinical trials with unique knowledge of local and EU regulations. Over our 25 year history we have built up substantial therapeutic and study experience, contributing to the efficient management of sites, budgets and communication channels with all parties involved. Venn is renowned for its hands-on approach and consistent delivery of high quality work on time and on budget. "
usa,A10 Clinical Solutions,"A10 Clinical Solutions (A10) helps its clients get their life-saving, innovative, investigational new drugs to market faster and safer by the quality management of critical clinical trials.A10 is known for its outstanding thought-leadership and is one of only a handful of certified woman and minority owned firms that provide clinical trials services. A10 supports functional outsourcing for Phase I – IV clinical trials that contribute to the FDA approval of therapeutic products for global biotech and pharmaceutical clients and studies conducted by government agencies and academic medical centers. "
usa,Aagami,"Aagami, Inc. is a life sciences consulting firm based in the suburbs of Chicago which offers,Strategic Consulting ServicesBusiness Development support in regions where you are unable to reach out due to bandwidthTechnology Licensing ServicesBusiness Research & Market Intelligence ServicesFor Global companies inPharmaBiotechMedical Devices & TechnologyConsumer HealthcareCROs, CDMOs, & AcademiaAagami brings,Deep Experience of overcoming business and socio-cultural differences of various countriesExtensive ‘C’ level network nurtured for over 15 yearsGlobal Deal making skills, honed for decadesPartners having combined experience of 250+ yearsSupplementing your bandwidth to save time, effort & cost "
usa,Absorption Systems,"Our mission is to continually develop innovative research tools that can be used to accurately predict human outcomes or to explain unanticipated human outcomes when they occur.Absorption Systems was Established in 1996Absorption Systems develops and implements research tools that allow our customers to better predict human outcomes. We have locations in Exton, Pennsylvania, San Diego, California, Medford, Massachusetts and Panama City, Panama. We work with a wide variety of customers in the pharmaceutical and biotech industry, including small virtual pharma companies, large pharma companies with weekly programs, and specialty CROs looking for services that complement their own offerings. Our flexibility allows us to adapt to the needs of each customer.We believe that projects should be viewed as a collaboration, which allows us to work with you to design studies and develop custom models when necessary. This collaborative approach has resulted in the generation of several innovative models to aid in drug discovery and development, through working partnerships within the industry and with regulatory agencies. "
usa,Accelerated Enrollment Solutions,"AES owns a proprietary database containing fully identified patient data. And we own a global site conduct organization. Put them together and you get a unique solution for global patient delivery that offers certainty of budget, time, speed, and quality. "
usa,Accell Clinical Research,"We are a full-service clinical CRO with a relentless mission to complete your clinical trial on time. Backed by our strong operational strategy and leadership, a devoted team of medical professionals in each country and connections to prominent medical institutions, your clinical study will be in good, caring hands. "
